Workshop,A : Activism,B : Characteristics of Nature in GUI,C : Connecting people,D : Non hierarchical Structure,E : Risk-taking but Safe Space,F : Sense of Autonomy and Ownership,G : Sense of Place,H : What GUI aims for
3 : 3_GUI_FGD_Young_26_below_Vols_12_Oct,"I became more of like an advocate.

I gather more knowledge and I realize that eh, I can step up and do a little bit more. Start to share with people what I know, why are we doing what we are doing, and how can I, within my means and within my circle, whoever that I interact with, share with them these small little nuggets of information, hopefully they become aware that there’s such thing being practised

Even though I know 1 voice is not going to do much, but it’s just so important to participate and to show that you believe in this political process of consultative decision making. I don’t just opt out because I believe that my voice won’t matter, but I participate, I tell people that I’ve participated. I think it helps to bridge the government-citizens trust, which is so fraught nowadays, so power of community

I think that over here, this thing about empowerment is, everyone, regardless of who you are, no matter how small your role is, has a part to play.","It gives you the pseudo feeling that you’re not in Singapore. Coming to GUI is sort of like a risk in itself for me

Whereas over here, maybe because we are on the ground, we are free to grow whatever that is suitable to be grown here. There’s more room to explore what can be grown, so I would say over here, boundaries are different from the ones outside","I’m actually quite introverted, so it’s a very comfortable place to talk to people, connect to the community.

My own interest is I really, genuinely could feel that they would love to interact with people, and somehow, I’m inspired to do likewise and take that up over time, and become more experienced.

I think it’s also more of the culture, how they really .. you know how GUI really values the human interactions, human relations and they like Hui Ying, our core team member, checks up on me

think that the core team, and how they emanate their positivity and the way that they model how to be generally just positive and good human beings is like, very important.

speaking about connection and interaction, interaction with people is not just talking. You don’t have to talk to interact.

We just spoke for a little while, and then there was silence all the way. But it feels very comfortable, the interaction was very therapeutic.

I think it goes as to the same, as to how human interaction and communities are formed. Again, it’s always very randomized. You don’t force things, whatever that’s happening around. That’s the biggest contradiction.","I think being in a place like GUI, that empowerment comes from people who humanizes you in a dehumanized world. As long as we are a group of people who realize that we are on the ground, we are flat, we treat each other with respect and dignity, as autonomous individuals. This is the empowerment that this place gives","It also helps me step out of my comfort zone, because I started out farming and craft, and then I moved on to helping the other programs ? I would never imagine myself teaching children at all, I will not sacrifice children’s lives at my hand

I feel that they genuinely welcome me and then somehow, over time by, myself also acquire that positive and negative and that.. I don’t know, that just becomes so infectious.

Slowly, Hui Ying will also be like, “ok you seem like you can do social media stuff” or “you have this talent, do you want to do more?” Yeah, I think she has done that a few times already. She’s quite good at picking up what people are good at.

With more involvement, on top of your regular work or regular school, I just slowly over time became more involved. Now I’m doing the social media stuff, Humans of GUI, Balik Kampung, farm tours. That also brings me to work closer with my other volunteers, it just keeps going forward.

I’m usually like, ok you do and I just follow. Whatever you need to do, you can ask me, saikang, I’ll do the dirty work for you. But I actually had to play a part in planning, it was a different take. It was the same event, but now I’m on a different side of it, the organizing side of it, a leadership kind of role in a sense. Previously, I think of inwards, myself, but now I think outwards.

all my leadership opportunities come with GUI

I learnt that it’s okay to fail. I think there’s a bunch of responsibilities that are recently put on me, because I think Hui Ying really needs help. I think with that, comes the stresses as always because first time doing something, it’s always like that stress. I don’t want to stress about this because it’s GUI. I don’t want to stress about this thing that GUI makes me do. If I fail to mention something at the start of Balik Kampung, or at the start of my kampung tour then so be it. Just fail in knowledge and learn. The learning mindset also. Just treating every week is learning

This place is freaking amazing and it makes me believe that “yeah, I could do something too” in my own life to make a meaningful contribution to society, in 1 way or another.

I go find my own fruit trees. I feel that there are certain fruit trees, or the grounds behind GUI that’s very uneven so sometimes some fruits have to be harvested like mangosteens

But somehow this place just encourages me to give it a try. You won’t know what would happen right? So I just try and things just happen. Now I can manually saw things, do things, fix certain things on my own.

It gives you the pseudo feeling that you’re not in Singapore. Coming to GUI is sort of like a risk in itself for me

First, engage them in conversation, then get to know them, then try to make them feel comfortable in this space, then try to make them come back, please come back! So having to think about that, it was outside my comfort zone.

coming to GUI and staying in GUI is a risk in itself for my well-being. For my perceived well-being. It probably helped me in my actual well-being

Previously I was like, if something was risky, I’ll be thinking should I take this risk, but now I’m thinking, should I take this leap of faith? So it’s kind of changed, a little bit like. my whole life has been quite smooth sailing, I went to good schools, so my path was very clear. If I followed my peers, there’s no way I can land badly in future. So I’m just, I’m more daring to steer from the usual path, do my own thing

But I think the ecosystem and the interdependency we have her made me realize that we need to see through what these risks are all about in the first place. What’s the actionable goal, while exploring the boundaries

I don’t like commitments, so I was like, try once first before trying to commit to coming here more regularly. That was a risk. Afterwards, it was also Hui Ying who asked me to try new things. Now from time to time I will participate in kampung tour, that kind of thing.","I’m inspired to do likewise and take that up over time, and become more experienced.

all my leadership opportunities come with GUI

I’m thinking of starting something next semester and even this semester, for my projects, I keep pushing for topics related to sustainability. I think being here allowed me to do that.

This place is freaking amazing and it makes me believe that “yeah, I could do something too” in my own life to make a meaningful contribution to society, in 1 way or another.

Even if it’s on a very small scale, I believe it’s to do things that I want to see in societies of the future. Like how do you want to build future resilience, climate resilience in societies, I think this is what we need. A farm. Woodworking space. Just the human connection.

I think that over here, this thing about empowerment is, everyone, regardless of who you are, no matter how small your role is, has a part to play.

You make the decision to do something to improve this small. As small as this, you don’t have to be the decision maker but yeah, helps to keep the space going. Know the bigger picture, but every small individual act contributes to this whole thing, this whole cause that we are doing.

I go find my own fruit trees. I feel that there are certain fruit trees, or the grounds behind GUI that’s very uneven so sometimes some fruits have to be harvested like mangosteens

I try to give the new volunteers the same experience that I got when I came over because I feel that’s only right. I got that experience.

But I think the ecosystem and the interdependency we have her made me realize that we need to see through what these risks are all about in the first place. What’s the actionable goal, while exploring the boundaries

What GUI does is that it gives a lot of ownership and empowerment to people to take their place and say that “oh I want to take care of this area” and that’s why we have active volunteers.

they bring with them knowledge like they’re architects, or whatever, retired already, they help to shape up this entire landscape base with their own idea. Because they’re tasked to take care of the space. They don’t have anybody to report to, because trust has been placed on them to take charge of that space
","
","I’d just like to add on. I think generally what keeps volunteers here is because we are not expected to be out of who we really are here. We are not expected to be able to fulfil certain things

I realized how important this space is for so many people in Singapore. Because we do not have this kind of community bonding that happens so organically, that’s not forced. It’s not something that our government does, that socially engineers people into different races, in different HDBs"
4 : 4_GUI_FGD_Vols_26_above,"People here don’t judge you but you would try to bring that back because you are so filled with it. The experience it fills you to the brim and overflowing. And you would want to bring it back and start doing it. And by you doing it, you’re actually spreading that ripples.

Because people here really walk the talk.

So here, they really walk the talk. And that makes the difference, because people observe. They don’t dismiss it, they see what they do. Ok, but are you for real? So here, it’s really for real. I think to me, that is a lot of difference.

But here, you come here you really walk the talk. Whatever values that you learned in school, but here you automatically would do it. Because somehow the space invites you to do it. And because people are really doing it. You just feel like, yeah it’s natural. Not because someone asked me to do it. It’s just natural, everybody just walk the talk.
","Real nature is like GUI. It looks messy but that’s how, you see, the weed, you know the weed has its own function if you really study it. Even the weed is there for a purpose. Little creepy crawlies are there for a purpose, even the leaves that dropped are there for a purpose.

Here, when you see all the weeds and stuff there, there are happy bees. Not that stressed ones that you see from farms to farms to pollinate. That’s the natural thing and that’s where you teach, like what she was saying, even the weeds have a purpose, right?

So the space, indirectly tells you whether is it open and inviting and non-judgemental, you can be truly yourself.

I think that’s the key here. I think to take a step back, it’s really about the environment. Laihock was very big on keeping this space, it’s because this space does make a difference on people. In the ancient Chinese saying, a person who’s wise, they would live near the mountains, because it gives them that perspective, that space.

There is an intention in the place.

There are some changes that you can observe the changes. I guess that is one thing that is different.","This is a place where I get to say ‘hi’ to people, and people wave back. Or initiate a wave

they always took time to engage with people that were there. Whether they were volunteers, or participants in some activities there. And always took time to put work aside and just sit down, have tea sessions at

So I would think that by and large, if we’re talking about how we can actually form relationships with people, I think its a no-brainer, people have to be friendly, welcoming and accommodating. But you must find something there that you can relate to and for the

when you have that space, you will attract people with similar frequency, I would put it this way. Like-minded people will come. Even birds, they will perch together.

Then this place inevitably will attract people who are warm, who are non-judgemental, who are open, and of course they are friendly people. And then you have people who are different ages

I think for the first time, it’s that this place is very welcoming. So I think you can already feeling… It’s very hard to put into words, I guess. And then as you come back more, it just build on each other and… it’s not so much about volunteering, how I can contribute

It’s very different from here where people just welcome you to smell it, touch it, and even pluck the top. They’ll teach you how to pluck so you won’t injure the plant. It’s very different.","And there are a lot of different people that we meet here. It’s all inclusive. SO I can learn a lot. So that’s the empowering part, to see that there’s so much out there fore you to explore.

Whereas here people are told to volunteer, to share their passion. They have Woodspace, purely run by volunteers, and you can feel and be infected. By their passion, they are truly from their own freewill, their passion. That you don’t feel it elsewhere, so it’s very different","So my motivation is really, first as a mother, I was looking for a space like this. Where the children can be grounded, can feel the earth, can touch, explore, and not being penalised or fined. At least they can be comfortable to ask questions, even though how silly it is, and to really explore with their senses.

I’m very comfortable with inviting new people in here. Like anybody. I don’t have to set any expectations. I know even if they get lost here, they will find something. So that’s the... To me you’re truly free when you have a home to come back to

So the space, indirectly tells you whether is it open and inviting and non-judgemental, you can be truly yourself.

And to the extent of healing it because this space is so inclusive, so embracing. There’s really no judgement, no right or wrong.

There’s no right or wrong, good or bad. Because everything here has its role. And it’s non-judgemental, it’s very embracing and inclusive. Whether you’re old or young, you’ll always have a part to play. And that is very healing in the sense that in an outside role","First we do the Balik Kampung, we do the farm. And subsequently I actually organised a holiday camp, school camp. Not school, but holiday camp during the school break where we bring children through various guided and unstructured activity, where they can experience something that is very much kampung like.

But for a lot of the activities that I see over here, people just really contribute to the growth of the farming plots over here

I think this whole space is very special in that, it’s very inclusive, is the word to use. In that, it doesn’t matter how old you are, it doesn’t matter what you can do, we always believe that there’s something you can contribute

But the fact is that the stuff that you do here, you feel the connection because you have left your mark. And in the world there is all these curation, it’s very hard to leave your mark, and people want to be noticed

Yeah, I contributed to something, and that it sustained the place. The volunteers are the lifeblood of this place. It wouldn’t carry if there are no volunteers supporting it.

the first question he asked was, so how can you contribute? You can start a project, do something that you want to do. So it’s very inviting. So we were like 6 years old, 3 years old, what can you do? As a mother, I was like, they’d do more destruction than good. But he actually had this vision that even young kids can contribute

It’s really their freewill. Yes, autonomy. They are truly empowered. It’s not like top-down direction. It’s really from their own freewill. I don’t feel like doing the dishes today, I don’t feel like helping out at the kitchen, I will do farming, I will do the… whatever. Or I feel like doing woodwork today, then I will go to the woodwork section and help. So they have choices, they have autonomy. They are able to engage based on their own freewill to choose what chores or what activity they want to do.

Whereas over here it’s really your choice. I think that’s really empowerment. What is it that you want to do, what is it that you want to contribute today. There a lot of things that you can explore and try. I think, you may not be very good at certain things, but then they still embrace, let you go and try and just make the best out of things. Or like try to work together to try and get the things to the standard that is needed

But for children, being able to, to their point, to just do whatever they want and have that freedom to explore, it leaves a very powerful mark on the them, to the fact that they actually want to contribute something to this space that gave them this room to express themselves

as children, what they experienced as teens will actually go on to shape their lives in very deep ways

Whereas here people are told to volunteer, to share their passion. They have Woodspace, purely run by volunteers, and you can feel and be infected. By their passion, they are truly from their own freewill, their passion. That you don’t feel it elsewhere, so it’s very different

What was very surprising to me when I was there, was how everybody when they stood up, they just...nobody needed to say anything, they just arranged all the chairs nicely and put them at the back. Without have to be prompted at all.

Since you can be yourself here, the space is here for you to express

They are not business-driven. They’re not profit driven. They are purely here out of their own free will to help. And they don’t ask for anything in return.

There’s no right or wrong, good or bad. Because everything here has its role. And it’s non-judgemental, it’s very embracing and inclusive. Whether you’re old or young, you’ll always have a part to play. And that is very healing in the sense that in an outside role

over here when we do things, and this is something that we have said across throughout this conversation, is that when we give, we don’t really expect anything in return. We do it because we actually want to contribute to the growth of this space. And that growth itself is the reward that we want, and being able to serve the people, that itself is good enough for us

I think it’s also building the intrinsic motivation to do something. So like how we’ve been saying freewill all that quite a lot but I think it’s really coming from the heart.

So trust, and intrinsic motivation is the next one I guess. It’s really something inside that drives you to do whatever that you’re doing and I think the people here, they really demonstrate that as well. And I think that alone gives you a lot of courage and a lot of power to do things
","But the fact is that the stuff that you do here, you feel the connection because you have left your mark.

Yeah, I contributed to something, and that it sustained the place. The volunteers are the lifeblood of this place. It wouldn’t carry if there are no volunteers supporting it.

I’m very comfortable with inviting new people in here. Like anybody. I don’t have to set any expectations. I know even if they get lost here, they will find something. So that’s the... To me you’re truly free when you have a home to come back to

when you have that space, you will attract people with similar frequency, I would put it this way. Like-minded people will come. Even birds, they will perch together.

I think that’s the key here. I think to take a step back, it’s really about the environment. Laihock was very big on keeping this space, it’s because this space does make a difference on people. In the ancient Chinese saying, a person who’s wise, they would live near the mountains, because it gives them that perspective, that space.

So when you’re in a space where it gives you a different perspective alive with things


But the fact is that the stuff that you do here, you feel the connection because you have left your mark.

Yeah, I contributed to something, and that it sustained the place. The volunteers are the lifeblood of this place. It wouldn’t carry if there are no volunteers supporting it.

I’m very comfortable with inviting new people in here. Like anybody. I don’t have to set any expectations. I know even if they get lost here, they will find something. So that’s the... To me you’re truly free when you have a home to come back to

when you have that space, you will attract people with similar frequency, I would put it this way. Like-minded people will come. Even birds, they will perch together.

I think that’s the key here. I think to take a step back, it’s really about the environment. Laihock was very big on keeping this space, it’s because this space does make a difference on people. In the ancient Chinese saying, a person who’s wise, they would live near the mountains, because it gives them that perspective, that space.

So when you’re in a space where it gives you a different perspective alive with things


But the fact is that the stuff that you do here, you feel the connection because you have left your mark.

Yeah, I contributed to something, and that it sustained the place. The volunteers are the lifeblood of this place. It wouldn’t carry if there are no volunteers supporting it.

I’m very comfortable with inviting new people in here. Like anybody. I don’t have to set any expectations. I know even if they get lost here, they will find something. So that’s the... To me you’re truly free when you have a home to come back to

when you have that space, you will attract people with similar frequency, I would put it this way. Like-minded people will come. Even birds, they will perch together.

I think that’s the key here. I think to take a step back, it’s really about the environment. Laihock was very big on keeping this space, it’s because this space does make a difference on people. In the ancient Chinese saying, a person who’s wise, they would live near the mountains, because it gives them that perspective, that space.

So when you’re in a space where it gives you a different perspective alive with things
","Yes, it’s not just we use to the technicalities of the activities itself. There’s many more deep secret layers to it. I cannot really verbalise it right now but it is not just about the activity itself. Because if it’s just the activity itself, you can take the same activity and do it elsewhere and the results will be the same

So things still have to be done in the right way, but the overall intention - that's the deciding factor to stop it from being too curated. Overall intention for you to be able to leave your mark, walk through these struggles to connect from one place to another."
